{
  "version_esquema": "2.0",
  "experimento": {
    "id": "H001-IS-REAL-008",
    "hipotesis": "H-001",
    "version": "real-is-v1",
    "fecha": "2026-09-24",
    "sintetico": false,
    "pregunta": "¿Rinde más DIA en el cambio de mes que el resto de sesiones?",
    "muestra": "IS",
    "inicio": "2009-10-01",
    "fin": "2020-12-31",
    "instrumento": "DIA",
    "frecuencia": "1d",
    "moneda": "USD",
    "capital_inicial": 10000.0,
    "reglas": {
      "entrada": "Comprar al cierre de la penúltima sesión de cada mes completo en IS.",
      "salida": "Vender al cierre de la tercera sesión del mes siguiente.",
      "tamano": "30 % de la equity al cierre de entrada, acciones fraccionarias; resto en efectivo sin remunerar; dividendos reinvertidos implícitamente; sin apalancamiento.",
      "costes": "0,01 USD por acción y lado; sin comisión adicional ni impacto."
    },
    "receta": "estrategias/H-001.md",
    "plan": "experimentos/H001-IS-REAL-008.md",
    "fuente_datos": "data/etf/indices/Dow Jones DIA - Temp. 1d - Date 2006-07-17 a 2026-07-15 - Norgate.csv"
  },
  "evidencia": {
    "estadistico": "Diferencia ventana − resto (TOM)",
    "unidad": "pb/día",
    "valor": 0.0548964496790874,
    "componentes": [
      {
        "nombre": "Sesiones TOM",
        "valor": 540.0,
        "unidad": "sesiones"
      },
      {
        "nombre": "Sesiones resto",
        "valor": 2293.0,
        "unidad": "sesiones"
      },
      {
        "nombre": "Retorno medio TOM",
        "valor": 5.615819250715807,
        "unidad": "pb/día"
      },
      {
        "nombre": "Retorno medio resto",
        "valor": 5.56092280103672,
        "unidad": "pb/día"
      }
    ],
    "desglose": {}
  },
  "robustez": {
    "bootstrap": {
      "metodo": "bloques circulares",
      "unidad": "mes",
      "bloque": 3,
      "replicas": 5000,
      "semilla": 7301,
      "nivel": 0.95,
      "ic_inf": -8.551792792377572,
      "ic_sup": 9.131228533842037,
      "incluye_cero": true,
      "motivo": "La hipótesis es mensual; bloques de 3 meses conservan la dependencia entre meses vecinos."
    },
    "por_anio": {
      "2009": -46.92150675391653,
      "2010": 23.922036622570026,
      "2011": -6.98091351767145,
      "2012": 11.408216377582342,
      "2013": -9.067561293948794,
      "2014": -9.166803239401052,
      "2015": -6.88753111570371,
      "2016": -8.308771725485682,
      "2017": 2.932967659644084,
      "2018": -3.8719639016070135,
      "2019": -12.268529478931875,
      "2020": 30.7344413651057
    },
    "sin_cada_anio": {
      "2009": 1.130055137660127,
      "2010": -2.2740160541655756,
      "2011": 0.7412902191875591,
      "2012": -1.0492101949176844,
      "2013": 0.9455158385912577,
      "2014": 0.9545834892950332,
      "2015": 0.7318567560637913,
      "2016": 0.8710835600128359,
      "2017": -0.2275432330317627,
      "2018": 0.44046694497418837,
      "2019": 1.2577380256841801,
      "2020": -2.941395093471893
    },
    "pnl_costes_x2": 836.0331077272219
  },
  "metricas": {
    "operaciones": 134,
    "pnl_neto": 886.3981370429865,
    "esperanza": 6.614911470470153,
    "tasa_acierto": 0.6044776119402985,
    "payoff": 0.8759201316127446,
    "profit_factor": 1.3386703898232515,
    "rentabilidad_total": 0.08863981370429874,
    "rentabilidad_anual": 0.007583185292587895,
    "sharpe": 0.36845876047552534,
    "sortino": 0.5282965978723193,
    "max_drawdown": 0.03976169301450838,
    "max_recuperacion": 1534,
    "drawdown_abierto": 0,
    "exposicion": 0.18919872926226614,
    "rotacion": 80.49052432805598,
    "costes": 50.3650293157645,
    "peso_costes": 0.008214265392453035,
    "concentracion_anual": 0.08955223880597014,
    "autocorrelacion": -0.04520536554674624
  },
  "no_calculables": {},
  "operaciones_por_anio": {
    "2009": 2,
    "2010": 12,
    "2011": 12,
    "2012": 12,
    "2013": 12,
    "2014": 12,
    "2015": 12,
    "2016": 12,
    "2017": 12,
    "2018": 12,
    "2019": 12,
    "2020": 12
  },
  "conclusiones": {
    "estado": "exploratoria",
    "lectura": "Diferencia ventana − resto (TOM): 0,05 pb/día. El intervalo incluye cero: en IS no se distingue de no tener efecto.",
    "supuestos": [
      "TOM = última sesión del mes y tres primeras del siguiente; resto = demás sesiones del mes.",
      "Retornos close-to-close ajustados por dividendos, antes de costes.",
      "Calendario observado conocido de antemano, incluidos cierres no programados (C5).",
      "Septiembre de 2009 excluido por incompleto."
    ],
    "limites": [
      "La simulación usa el 30 % de la equity: rentabilidad y drawdown dependen de ese tamaño, no miden el edge.",
      "El intervalo no corrige la exploración histórica previa de esta hipótesis.",
      "Sin comisiones adicionales, impacto ni ejecución intradía."
    ],
    "siguiente_comprobacion": "En IS, sensibilidad al calendario y a bloques de 1 y 6 meses con la regla fija. OOS sigue bloqueado."
  },
  "procedencia": {
    "motor_sha256": "d02bb5dbd1349bc6bb864939bcc51f402f39ce38693215b6151b0b6a5ccef455",
    "datos_sha256": "2bc2424f712f9ee1449ff855a2e9e55154c50f0499d3bfec199664a6a7f17e77",
    "plan_sha256": "4a572f622b07342f566ad02eaedfb46c2a1791a30ee6f27f15f43632752f909c",
    "periodos_por_anio": 252
  },
  "historial": [
    {
      "id": "H001-IS-REAL-001",
      "fecha": "2026-09-24",
      "cambio": "Primera ejecución real (2026-09-22); regenerada con el ejecutor único."
    },
    {
      "id": "H001-IS-REAL-002",
      "fecha": "2026-09-24",
      "cambio": "Misma especificación que H001-IS-REAL-001 con QQQ en lugar de SPY."
    },
    {
      "id": "H001-IS-REAL-003",
      "fecha": "2026-09-24",
      "cambio": "Misma especificación que H001-IS-REAL-001 con IWM en lugar de SPY."
    },
    {
      "id": "H001-IS-REAL-004",
      "fecha": "2026-09-24",
      "cambio": "Misma especificación que H001-IS-REAL-001 con DIA en lugar de SPY."
    },
    {
      "id": "H001-IS-REAL-005",
      "fecha": "2026-09-24",
      "cambio": "Mismo plan que H001-IS-REAL-001; tamaño 30 % de la equity por operación en lugar de 1 acción."
    },
    {
      "id": "H001-IS-REAL-006",
      "fecha": "2026-09-24",
      "cambio": "Mismo plan que H001-IS-REAL-002; tamaño 30 % de la equity por operación en lugar de 1 acción."
    },
    {
      "id": "H001-IS-REAL-007",
      "fecha": "2026-09-24",
      "cambio": "Mismo plan que H001-IS-REAL-003; tamaño 30 % de la equity por operación en lugar de 1 acción."
    },
    {
      "id": "H001-IS-REAL-008",
      "fecha": "2026-09-24",
      "cambio": "Mismo plan que H001-IS-REAL-004; tamaño 30 % de la equity por operación en lugar de 1 acción."
    }
  ],
  "ficheros": {
    "equity": "equity.csv",
    "operaciones": "operaciones.csv",
    "ficha": "ficha.md"
  }
}
